titulo,fecha,cuento
Morir con buen gusto,6/25/08,"Fría mañana de sábado en Mercedes. En la vereda oeste de la casa velatoria Rossi un pequeño grupo de personas fuma en silencio y hace tiempo para entrar. En el interior de la sala hay otros corrillos, otros grupos, que conversan en voz baja de espaldas a un ataúd donde reposa el cadáver de un viejo. Casi todos los concurrentes son personas mayores vestidas de negro. Por eso destacan, junto al féretro, dos niños de cinco años. LUCAS acaba de llegar. En cambio ALEX está allí desde temprano.
LUCAS.- ¿Querés que vayamos afuera a jugar, Alex? ¿No te aburrís acá parado?
ALEX.- Si querés andá vos. Yo prefiero quedarme mirándolo hasta que lo tapen. Le van a poner esa chapa encima.
LUCAS.- Dice mi mamá que te distraiga y que te saque un poco a tomar aire. Es más, me parece que me hicieron venir solamente para eso. Así que no me hagas quedar mal... Mirá cómo me hicieron vestir.
ALEX.- Vos no te preocupes, en todo caso abrazáme un cacho y hacete el triste. (Pausa.) Pero quedáte acá conmigo, no te muevas. Y mirálo bien.
LUCAS.- ¿A quién?
ALEX.- A mi abuelo, boludo. ¿A quién va a ser? No todos los días te dejan ver un muerto de cerca. Aprovechá.
LUCAS.- Me da un poco de asco, nunca había visto a un muerto... Solamente al coyote, cuando se le cae una piedra en la cabeza, o algo. Pero al toque aparece otra vez sano, persiguiendo al avestruz. Los dibujos se mueren, pero poquito.
ALEX.- Mi abuelo se quedó así anoche, y desde ese mismísimo momento no lo puedo parar de mirar. Es más fuerte que yo. Como cuando la miro a mi vieja desnuda, cuando se baña y la espío, pero distinto. No es el mismo placer, es otro.
LUCAS.- No podés comparar una madre en bolas con un abuelo muerto. Enfermito.
ALEX.- No estoy comparando, salame. Pero te quiero decir que ver a un muerto también te hipnotiza un poco. Hay algo, como un imán, una curiosidad... ¡Y no sabés la sensación buenísima que te da chuparlo!
LUCAS.- ¿Lo chupaste?
ALEX.- Mi mamá me mandó a darle un beso, hace un rato. Yo al principio no quería. Pero ella me dijo que había que despedirse. Entonces le di un beso normal, pero no sé, se me cruzó algo por la cabeza y saqué la lengua... ¡Para qué! Lucas, creéme, es espectacular...
LUCAS.- ¿En serio chupaste a un viejo muerto?
ALEX.- Ahora ya no puedo parar... Le di como cinco o seis lambidas, cada media hora le doy otra, es un vicio. ¿Querés chuparlo un poco?
LUCAS.- Qué sé yo, Alex. Si fuera pariente mío... Pero yo no lo traté mucho.
ALEX.- ¡No, boludón! No digo que lo chupes por un tema de cariño. Solamente tocále el cachete con los labios... Hacé contacto. Vas a ver lo que pasa.
LUCAS.- Qué pasa.
ALEX.- Vos dale, Lucas, sin compromiso. Primero hacete el triste, para que la gilada no piense que estamos gozando... Después ponete en punta de pie y pasále la lengua por la cara. No mucho. Dos o tres segundos. Hace ruido de beso, para caretear.
LUCAS se pone serio, mira para los costados y hunde la cabeza en el ataúd; oímos un largo chuic. Pasa más tiempo. Regresa con los ojos muy abiertos y una media sonrisa.
ALEX.- Papá sabe, eh... ¿Viste qué flash?
LUCAS.- (Maravillado.) ¡Es... absolutamente impresionante! Está resbaloso y duro, agridulce, como si le hubieran puesto plasticola por la cara.
ALEX.- ¡Es un conogol, hermano! Duro y fresquito, como bañado en chocolate invisible... Yo no puedo parar de chuparlo desde la mañana temprano. Las viejas están encantadas conmigo. Dicen ""Qué nieto más cariñoso"".
LUCAS.- Y además el olor está bueno. Acompaña.
ALEX.- Y pensar que cuando estaba vivo yo no lo quería tocar ni con un palo, a mi abuelo... Mi vieja tenía que hacer un escándalo para que yo le diera un beso. Las despedidas eran muy trabajosas.
LUCAS.- Claro, porque chupar viejos tibios es horrible. ¡Pero así, muerto, es otro cantar!
ALEX.- Trasca los viejos tibios están arrugados. Y tiemblan mucho, y te dejan baba en el cogote. Pero así, fríos y metidos en una caja, son más elásticos, más fresquitos. No sé, más...
LUCAS.- Más campechanos.
ALEX.- Claro, eso. (Larga pausa, retoma en tono confidente.) Mi abuelo estaba hecho mierda la semana pasada, tenía la piel que se le caía a cachos, decía boludeces de Onganía, se tiraba pedos... Mirálo ahora, un señor. Parece que tuviera veinte años menos, ni una arruga, olor a lustramuebles, buena pilcha.
LUCAS.- (Poniéndose en puntas de pie.) ¿Puedo darle otro?
ALEX.- (Lo detiene.) Pará un cachito, Lucas; si los grandes se dan cuenta que el abuelo nos gusta, se acabó la joda. Disimulá la cara, que no se te note la adrenalina.
LUCAS.- ¿Así?
ALEX.- No, esa cara es para cuando rompés cosas de vidrio. Poné la trompa para afuera.
LUCAS.- ¿Así?
ALEX.- Eso, y la ceja más abajo. Ahí. Y además tenés que hacerte el compungido. Hagamos lo mismo que ellos, ¿ves?, que parecen palomas asustadas. Caminemos un poco en redondo y hagamos que no con la cabeza.
LUCAS.- ¿Por qué hablan todos bajito?
ALEX.- Porque se murió mi abuelo, pelotudo. Los grandes hablan así cuando quieren estar tristes y no les sale.
LUCAS.- También hablan bajo cuando explican cosas de coger y cuando van al teatro y no les gusta la obra.
ALEX.- Y cuando se muere gente también. Y cuando chusmean cosas de un vecino que vive al lado. Me gustan los grandes afónicos, son más mansitos.
LUCAS.- ¿Vos pensás que nosotros nos vamos a morir así?
ALEX.- Cómo, así.
LUCAS.- Duros y fresquitos.
ALEX.- Yo no quiero pensar mucho sobre el tema de que me voy a morir... Mejor disfrutemos de chupar un muerto. Tenemos cinco años, Lucas, si no frivolizamos ahora, ¿cuándo?
LUCAS.- ¿Pero no te pusiste a pensar en que esto nos va a pasar a nosotros también?
ALEX.- ¿Morirnos?
LUCAS.- Sí.
ALEX.- No, no me entra en la cabeza. Me da cagazo pensar en esas cosas. Y si les preguntás a los grandes es peor, porque tampoco saben bien. Te dicen cosas raras del cielo, de dios, de los angelitos.
LUCAS.- Mi vieja se puso nerviosa cuando le pregunté qué es abortar. Y me apagó la tele.
ALEX.- ¿Qué estabas viendo?
LUCAS.- Una película del espacio, la nave se volvía porque se había abortado la misión.
ALEX.- Hoy a la mañana, cuando veníamos en auto para acá, mi vieja lloraba, lloraba... En un momento le agarró un ataque y se puso a gritar. ""No lo voy a ver más, no lo voy a ver nunca más"". ¿Y sabés qué pensé?
LUCAS.- No.
ALEX.- En un día que me senté a ver Sheriff Lobo, a las ocho, y los putos de Canal 7 cambiaron la programación y lo pusieron a BJ. Yo estaba igual que mi vieja, tenía algo acá, algo horrible.
LUCAS.- Morirse debe ser eso: no ver nunca más nada.
ALEX.- Que se apague la tele para siempre.
LUCAS.- Que la desenchufen.
ALEX.- Mi abuelo ahora es una tele apagada.
LUCAS.- Yo tengo un solo abuelo. Le dan de comer por un tubito y respira por otro.
ALEX.- Tu abuelo es televisión por cable.
LUCAS.- Claro. Lo tenemos en casa pero es carísimo, y no sirve para nada.
ALEX.- Qué loco. No me dan ganas de llorar. Éste era el último abuelo que me quedaba, pero no estoy triste.
LUCAS.- Aprovechá y chupalo un poco más, antes de que lo tapen para siempre. ¿Te hago pie?
ALEX.- Dale, y después lo chupás un poco vos.
LUCAS.- Pero del otro cachete. Me da asco tu baba.
LUCAS ayuda a ALEX a encaramarse al ataúd. Después de unos segundos vuelve al suelo, pasándose la lengua por los labios.
LUCAS.- ¿Y, qué tal?
ALEX.- (Entrecerrando los ojos, con placer.) Frutado, persistente, se le nota la madera.
LUCAS.- Claro. Va ganando con el tiempo...
— (Telón)
Hernán Casciari
25 junio, 2008"
Abrir y cerrar un círculo,7/3/08,"La última vez que estuve en Buenos Aires fue hace cinco años. No existía la Nina, ni yo sabía qué cosa era un blog. Estuve allí veinte días en los que, sin saberlo, abracé a mi abuela Chola por última vez. También conversé con gente que quiero, padecí a Racing en directo y pisé Mercedes. Llegué a Ezeiza con un presidente y me volví a Barcelona con otro. Al regresar pasaron dos cosas, al mismo tiempo, que abrieron un círculo en mi vida: empecé a escribir unos cuentos en internet y Cristina me dijo que estaba embarazada.
Todo ocurrió en septiembre de 2003: vivíamos en un departamento del barrio de Gràcia que entonces nos parecía suficiente. Yo tenía un empleo nocturno, tan nocturno que me lo retribuían en negro, porque mi ciudadanía italiana no llegaba nunca. Era un trabajo periodístico aburrido, facilón y mal pago que, sin embargo, me salvó el bolsillo en las épocas que no portaba una nacionalidad decente.
Me levantaba a las dos de la mañana y me iba a una oficina de la Rambla Catalunya. Debía estar allí hasta las nueve, la noche entera, haciendo una labor absurda que no requería más de dos horas. Para no aburrirme las cinco restantes, abrí un blog y empecé a escribir en él como si fuese un ama de casa de pueblo.
Tenía tan fresco todavía el viaje a Buenos Aires, tan presente la música oral de Mercedes, que me pareció divertido llegar a la oficina cada madrugada y hacer una caricatura de mi barrio, una exageración de mi familia, un chiste interno de aquel descontrol que me había empapado durante veinte días. No buscaba nada escribiendo aquello, pero inventarlo me hacía feliz.
Una de esas noches, mientras tecleaba los primeros cuentitos, inició sesión Cristina en el messenger (ella en casa, yo en la oficina) y sin decirme hola escribió:
—Vamos a ser papás.
Dejé al ama de casa del blog hablando sola, las luces prendidas del edificio, el ascensor abierto, las llaves puestas, y me escapé del empleo nocturno a mitad de la noche, pidiendo a gritos un taxi, para que Cristina me repitiera esas cuatro palabras a la cara. No buscábamos un hijo, pero la noticia me hizo feliz.
Todo lo que pasó desde entonces fue veloz, extraño e imprevisto. La panza de Cristina creció, mi culo creció, el blog del ama de casa se llenó de gente desconocida. Cada vez hacía menos sacrificios en el empleo nocturno: dedicaba las noches, ya casi al completo, a escribir aquellos cuentos, que sin querer se estaban convirtiendo en una novela rara y espontánea.
Yo sabía que, tarde o temprano, mis jefes se darían cuenta de mi inoperancia descarada, pero busqué hasta el final un equilibrio entre el mínimo esfuerzo y el ocio permanente. Entonces, una tarde, nació Nina. Al mismo tiempo acabé aquel blog de la mujer gorda y comencé otro de textos breves, en el que me dediqué a despotricar contra España con la voz de un argentino quejoso.
Poco después, y gracias a esos hobbies, ya no tuve que ir a ninguna parte a fingir un empleo, porque había encontrado —sin buscarlo mucho— el modo de hacer redituable el ocio, aniquilando el esfuerzo por completo.
Cuando tuve todo el tiempo del mundo otra vez conmigo, e incluso papeles que me permitían salir y entrar de España, tampoco volví a Buenos Aires. Preferí traer aquí a personas queridas que nunca habían visitado Europa. Invité primero a mi hermana para que conociese a su cuñada, después a mis padres para que conocieran a su nieta, a Chiri en el mes del Mundial de fútbol, etcétera. Volver a un sitio no siempre es regresar, a veces volver es sentarse a tomar mate con los de siempre, donde sea. Cada vez que ellos venían a casa, yo de alguna manera cruzaba el mar.
Pero técnicamente, sin metáforas, hace cinco años que no estoy en Buenos Aires. Y ahora en casa está abierta la valija en pleno verano, llenándose de ropa de invierno, porque en dos semanas debo estar allí otra vez. En la Argentina, después de cinco años. Y yo soy una bolsa llena de nervios y de ansiedad.
Viajo para presentar un libro. Uno que escribí aquí (no digo aquí en España, sino aquí, acá mismo, en este cuaderno virtual). Y también viajo para hacer algo que tengo muchas ganas de hacer, y que a la vez me produce un terror indescriptible: voy a encontrarme con ustedes, con los lectores de mis cuentos, cara a cara.
La gente de la Editorial Sudamericana pensó que la presentación debía hacerla algún famoso, un personaje conocido del ambiente. Alguien a mi lado que hablase de mis virtudes y que oficiara de moderador. Yo les pedí, de rodillas, que no organizaran un evento de ese tipo, les dije que la gente famosa me hace tartamudear, que con alguien conocido al lado me costaría un perú sentirme cómodo.
—Estoy hecho un chancho —les revelé—, y además tengo acento gallego. No me lo hagan todavía más difícil.
—Pero es la presentación de tu libro —argumentaron—, y tiene que haber un presentador, ¿o querés estar ahí solo?
—No, solo ni en pedo. Que trabaje otro.
Yo me doy cuenta, a veces, que mi intransigencia parece absurda. Que cancelo caminos sin abrir puentes. Que planteo los problemas pero no ofrezco una puta solución. Pero no son caprichos vagos: es que puedo oler el careteo a kilómetros de distancia, y hace muchos años decidí no sonreír sin ganas. ¿Qué voy a hacer yo al lado de un tipo que no me conoce y al que no conozco? ¿Fingir qué? ¿Para qué? ¿Y qué voy a hacer ahí solo, muerto de miedo, si hace ya cinco años que desterré el esfuerzo de la responsabilidad y de la compostura?
—Hagamos lo siguiente —me propusieron las chicas de Sudamericana, que son un canto a la paciencia—: nosotras vamos buscando el lugar, alguna librería grande de Buenos Aires, y vos, mientras tanto, pensá en el nombre de algún personaje conocido que no te intranquilice mucho. Pero necesitamos un presentador, Hernán: sí o sí.
Estuve toda la semana dándole vueltas al asunto, recorriendo de punta a punta la encrucijada, en vano. Ya casi estaba al borde de aceptar a cualquier famoso que me propusieran, pero el martes, mientras cagaba, tuve una revelación fundamental. A veces ocurre que las soluciones se encuentran tan al alcance de la mano, las respuestas tan a la vista, que somos incapaces de verlas con claridad.
Ayer volvimos a hablar por teléfono con las chicas de la editorial y les comuniqué, lleno de alegría, mi decisión:
—Quiero que el presentador sea el Chiri —les dije.
Del otro lado del teléfono se hizo un silencio.
—¿Quién?
—El Chiri —repetí—. Es el único que me tranquiliza.
—¿Pero es conocido?
—¡Claro! Lo conozco desde que hicimos la Comunión.
Intentaron hacerme entrar en razones, primero con delicadeza y después con súplicas. Pero yo ya había tomado una decisión inquebrantable. O el presentador era Chiri o yo me quedaba en casa y se metían los libros en el culo.
Tuvieron que aceptar.
Una vez que, a regañadientes, me dieron el sí definitivo, me faltaba convocar al conocido en cuestión. Entonces mandé un mensaje de texto al teléfono del Chiri:
¿podés hacerme quedar mal adelante 
de todo el mundo, el 16 de julio a la nochecita?
A los cinco minutos sonó la chicharra del teléfono. Mi amigo había escrito:
por supuesto bombón, 
decime dónde hay que ir.
Es todo tan fácil, con cierta gente.
Mientras en casa Cris hace las valijas, mientras Nina pregunta si a la Argentina se puede ir en tren, no puedo dejar de pensar que se cierra un círculo en nuestras vidas. Un redondel perfecto que empezó en Buenos Aires y acabará en Buenos Aires, cinco años después.
Ellas no conocen esas calles, nunca vieron librerías tan inmensas; yo tampoco conozco mis propias calles con una hija de la mano, ni conozco las librerías de Buenos Aires con libros que llevan mi nombre. ¿Qué verá Nina cuando vea, desde el taxi, el Obelisco? ¿Entenderá Cristina, a un golpe de vista, que eso que parece un mar es en realidad un río? ¿Qué veré yo cuando vea a mi fantasma de veinte años bajar por Leandro Alem de noche, fantaseando con ser un escritor?
Llegaremos a Ezeiza el día 15 de este mes, con tiempo para dejar los bártulos en el hotel y descansar del viaje. Al día siguiente, miércoles 16 de julio, todos los personajes de ficción que aparecen en este cuaderno estarán en cierta librería de un coqueto barrio porteño, desde las siete de la tarde. Mi amigo el Chiri será el presentador de un libro que escribí en este cuaderno y que lo tiene como protagonista. Yo estaré a su lado, con la tranquilidad más grande del mundo.
Me haría muy feliz que ustedes pudieran estar allí, cerrando el círculo.
Hernán Casciari
3 julio, 2008"
Cucarachas con termómetro,7/8/08,"Dos veces a la semana suena el teléfono en casa, o el timbre, y del otro lado aparece un encuestador. Cada vez hay más y se presentan mejor preparados. Con el tiempo, han aprendido a ser inmunes al NO. Saben minimizar las excusas y están por todas partes, mendigando quince minutos de nuestras vidas. Si un día la Tierra padeciera un conflicto químico que aniquilase todo —plantas, animales, gente— seguirían sonando los teléfonos por la mañana. El encuestador es la nueva cucaracha del mundo.
Quieren saber qué periódicos leemos, qué champú usamos, a qué partido político respondemos; quieren saber si hacemos deporte y, en caso afirmativo, cuál o cuáles. Desean conocer si hay niños en casa y cuántos, si tenemos televisión por cable, cuál es la última publicidad que podemos recordar. Si fuimos o somos infieles.
Más tarde los periódicos nos informan sobre los resultados de estos estudios. Es decir, la prensa nos comunica cómo somos.
Nos dicen los diarios, por ejemplo (y escojo titulares reales de este mes) que cada vez más adolescentes consumen tranquilizantes, que los chilenos piensan que las Cataratas son brasileñas, que los italianos son fogosos y las francesas liberales, que los hombres hablan más de fútbol que de mujeres, y que tres de cada cuatro españoles se fue de putas este año.
Todos los días, en la prensa, en la radio y en los informativos de la tele, hay por lo menos una afirmación categórica generada por el método de la encuesta. A razón de trescientas afirmaciones por año, nos vamos enterando cuántas veces nos masturbamos en promedio, descubrimos que nuestras esposas ya son casi tan infieles como nosotros, y averiguamos un sinfín de cuestiones sobre nuestras costumbres. ¿Todas? No señor, todas menos una.
Hay un estudio sociológico que nunca nos fue revelado, que guardan bajo siete llaves, que esconden como un diamante. Los encuestadores poseen un dato sobre nosotros, un solo dato, que jamás publicarán ni darán a conocer a los medios de comunicación. Tras cartón, es el resultado más exacto que podrían conseguir sobre una costumbre humana, porque es la única pregunta que siempre hemos respondido todos. Absolutamente todos. La pregunta, con variantes de cortesía, es ésta:
—¿Me permite usted que le haga unas preguntas?
En esa disyuntiva no hay opción para el no sabe, ni tampoco para el no contesta. No hay dudas. No existe la posibilidad de la mentira ni de la excusa. En todos los casos, los miles de millones de humanos interceptados en el último año, en cualquier parte del mundo, por teléfono o en persona, hemos dicho SÍ o hemos dicho NO. Y los encuestadores conocen los porcentajes exactos de esta tendencia.
Pasa lo mismo con los móviles callejeros de la televisión. Los informativos le ponen el micrófono a las personas y les preguntan, por ejemplo, si el sueldo les alcanza, o si son felices. Pero no explican los informativos, ni siquiera en letra pequeña sobreimpresa, que la enorme mayoría de los consultados pasa de largo, que sólo hay una minúscula porción de la humanidad que adora ponerse frente a una cámara para responder cualquier cosa, ni tampoco informan que esa raza suele llamarse, técnicamente, los imbéciles.
Es increíble, y también fascinante, que casi nadie distinga esta verdad tan sencilla en el momento de creer o descreer lo que aseguran los medidores de las costumbres humanas.
Los encuestadores conocen, sin margen de error, un guarismo exacto sobre nuestro hábito de responder. De hecho, es el único resultado que poseen sobre nosotros como conjunto absoluto. Todos los demás estudios que publican hasta el hartazgo, día a día, están limitados al pequeño grupo de gente aburrida —o que justo esta tarde estaba drogada— que ha contestado SÍ a la primera pregunta. Y estos serán, como mucho, un 11% de la población mundial (estoy dejando propina).
Ya tenemos un dato revelador, entonces. Todo lo que sabemos sobre nuestras costumbres, fobias, manías y emergencias es el resultado de los hábitos de gente aburrida o que, justo esta tarde, estaba dispersa y con ganas de conversar. Anoten esto en sus cuadernos y sigamos adelante.
Fijémonos ahora cómo cambia un enunciado cuando le agregamos esta evidencia: «Los hombres drogados hablan más de fútbol que de mujeres». O cómo se modifica el sentido de este otro titular: «Las señoras que no tienen nada que hacer a la tarde son casi tan infieles como sus esposos aburridos». E incluso de éste: «Los adolescentes que se pasan veinte minutos contestando encuestas, en lugar de hacer algo mejor con su tarde, consumen cada vez más tranquilizantes».
¿Pero qué pasa con los demás, con los que contestan siempre NO a la invitación de ser acribillados con preguntas? Son el 90% de la población mundial y poco o nada sabemos sobre sus quehaceres.
¿Qué champú usan los que no tienen tiempo para contestar boludeces? ¿Son infieles los matrimonios que no conversan por teléfono con extraños? ¿Practican deporte habitualmente aquellos que prefieren esquivar un micrófono por la calle? ¿Qué opinión tienen los tímidos y los sensatos sobre el conflicto del campo en Argentina? ¿Utilizan videojuegos violentos los jóvenes que a la hora que suena el teléfono del encuestador están en la hemeroteca estudiando? Nadie, absolutamente nadie lo sabe. Porque la enorme mayoría de la gente está en sus cosas.
Hay, además, una segunda certeza brutal, que involucra a las minorías que SÍ responde siempre, una certeza que empaña incluso los resultados parciales del grupo. Es sabido que la gente aburrida y la gente que se droga a la tarde tiende a mentir; los primeros como escape a una realidad insípida, y los otros por dispersión y anacronismo. Con esto generamos una nueva evidencia: el 96% de los que responden a encuestas, miente; a veces queriendo y otras veces sin querer.
Conseguimos así un segundo dato revelador. Todo lo que sabemos sobre nosotros como sociedad es el resultado de compilar las mentiras que dicen los drogados y los aburridos. Apunten esto también en sus cuadernos.
Vivimos dos realidades. Por una parte sabemos quiénes somos en casa, y por la otra creemos intuir qué representamos como sociedad. Pero casi nunca reconocemos, ni en el hogar ni en la calle, que nos gobiernan unos parámetros que están dictados por el absurdo y la mala interpretación.
Yo, por ejemplo, uso champú Sedal. Lo hago porque su envase dice que es el champú más usado del mundo. Sospecho se ha llegado a esta conclusión haciendo una encuesta que solamente han respondido los aburridos y los drogados. Uso, entonces, el champú que dicen usar los que no tienen nada que hacer con sus vidas. Esto puede resultar inofensivo en algunos casos, puesto que a nadie se le cae el pelo con ningún champú. Pero otras veces, no sé, salimos a la calle con dos cacerolas, convencidos de que afuera están haciendo ruido los que son como nosotros.
Deberíamos tener más presente, y sin embargo olvidamos el dato con frecuencia, que el objetivo de las encuestas es idéntico al de un termómetro: hundirse en el recto de la sociedad para conocer la temperatura de nuestras emergencias y hábitos. Pero atención. Solamente unos pocos culos sucios se prestan a una vejación tan estúpida, y las cifras del termómetro, cuando emerge, suelen estar salpicadas de mierda.
Hernán Casciari
8 julio, 2008"
