titulo,fecha,cuento
La revancha,6/19/09,"Son las cuatro y mi hija acaba de tener una pesadilla. Se despertó llorando y me contó el sueño mientras hacía pucheros. Yo escuché la historia, le acaricié la cabeza y la tranquilicé. Mientras me describía al protagonista de su pesadilla intenté que no notara mi angustia. Ella no tiene edad todavía para entender mi sobresalto. Ahora que ha vuelto a quedarse dormida, ahora que el desvelado soy yo, voy a intentar contar la historia completa. Hace mucho que no escribo, quién sabe cómo saldrá.
La pesadilla que acaba de tener mi hija es una venganza para su padre. Una revancha de la que ella, pobrecita, es solamente un daño colateral. Como los chicos que quedan en medio de un tiroteo, la Nina se metió hace un rato, sin querer, en la guerra de otros. Para ordenar las ideas tengo que irme al Buenos Aires del noventa y cuatro.
En esa época yo era un tipo flaco, de veintitrés años, que trabajaba en una revista económica llamada Énfasis. Allí escribíamos —completamente drogados— sobre logística, packaging, management y alimentación. Desde un segundo piso de la calle Leandro Alem yo dirigía, sin conocimiento de causa, un dossier sobre gestión ambiental en la empresa. La palabra que más me gustaba escribir en esa época era «biodesarrollo».
Al principio me aburría bastante, pero un par de meses después de que me aceptaran, logré que incorporasen también al Chiri y entonces las tardes empezaron a ser divertidas, y también más rentables. Como ya teníamos un par de sueldos decentes, empezamos a vislumbrar la posibilidad de dejar de ser pobres y mudarnos a un lugar mejor. Justo entonces nos hicimos amigos de Andrés Gelós, un personaje muy pintoresco del Departamento Comercial de Énfasis, al que yo le debía mi puesto de trabajo. Él me había recomendado a los jefes, con grandes mentiras.
Andrés Gelós, el Chiri y yo decidimos alquilar una casa enorme en Villa Urquiza, con muchas habitaciones y terraza, para vivir los tres y compartir los gastos. Estábamos convencidos de que la idea era perfecta, porque en la redacción nos llevábamos muy bien. Con ese único indicio a nuestro favor, apostándolo todo a esa ecuación tan torpe, inauguramos convivencia junto a un desconocido. Gran error, por supuesto. ¿Pero quién podía anticiparse a las desgracias en los noventa?
El Chiri y yo veníamos boyando por diferentes barrios porteños desde los diecisiete, y no teníamos intención de dejar la adolescencia. Si ahora usábamos traje y escribíamos sobre el desarrollo de las pymes, sabíamos que aquello duraba de trece a diecinueve horas. Una vez fuera de la redacción, había que volver a la idiotez con urgencia. Estábamos acostumbrados a comer arroz de la olla y a limpiar el baño solamente cuando venían mujeres. Nuestra vida de entonces consistía en ver televisión y fumar porro. Y nuestra lucha, a brazo partido, era lograr que nada cambiara de repente.
Andrés Gelós, en cambio, había vivido hasta entonces con sus padres y su hermano; como es lógico, la aventura de irse de casa le resultaba excitante, evolutiva, y más que nada iniciática. Él estaba dejando la pubertad porteña de estar cerca de papi y mami, y se planteaba inaugurar su madurez en casa propia, con un par de amigos del trabajo que le caían muy bien. Andrés Gelós quería que todo resultara perfecto. Y nosotros, sin querer (bueno, yo un poco queriendo) se lo hicimos muy cuesta arriba.
No voy a contar los detalles de cada conflicto, porque fueron muchos y es posible que quiera narrar otros cuentos de aquella época, que fue maravillosa. La debacle de la convivencia ocurrió de a poco, y en un porcentaje enorme por mi culpa.
Por alguna razón, cada mejora que Andrés le hacía a la casa, yo la rompía, más tarde o más temprano.
Una mañana llegó a casa con una mesa de pimpón hermosa para la terraza. ¡Ah, cómo jugamos, con cuántas ganas, durante un mes entero! Desde el primer día, como si fuera un padre de bigote entrecano, nos recomendó guardarla siempre bajo techo después de jugar. Al segundo mes la mesa amaneció doblada por la lluvia y derretida por el sol, y nosotros debajo, durmiendo.
Si bien muchas cosas las rompíamos el Chiri y yo, juntos, Andrés me echaba la culpa solamente a mí, porque (nunca supe el motivo) ningún ser humano es capaz de enojarse con el Chiri.
Un domingo Andrés organizó un asado para su familia, y quiso que nosotros estuviéramos allí. ¿Por qué hacía esto, si nosotros odiábamos a las familias en general? Nos lo pidió de rodillas y accedimos. Una vez que formábamos parte del almuerzo, nos hizo limpiar la casa. Estuvimos toda la mañana barriendo y fregando y, es verdad, no debimos habernos drogado desde tan temprano.
Cuando llegaron los padres de Andrés, y su hermano mayor, me encontraron tirado en el suelo, boca arriba, con una botella de yogur que me goteaba líquido blanco en los ojos. Yo gritaba:
—Acabáme en la cara, acabáme en la cara...
Chiri estaba desparramado de la risa del otro lado de la habitación. Los padres de Andrés no quisieron aparecer nunca más por la nueva casa de su hijo. Su hermano Pablo, en cambio, empezó a venir más seguido.
Pablo Gelós era unos años mayor que Andrés y estaba completamente loco. Tuvimos con él una amistad fragmentada pero intensa. No lo veíamos mucho, pero cuando aparecía por la casa era como si llegase un Andrés con menos pelo y mucho más relajado. Cuando había discusiones serias entre nosotros y su hermano, Pablo no se metía. Sabíamos de él que era actor, un gran comediante.
Pasaban los meses en la casa de Urquiza y era obvio que tarde o temprano Andrés Gelós iba a explotar. De algún modo, nosotros hacíamos lo imposible para que nos echara a la mierda. La vida en la casa nos resultaba cada vez más agradable, sobre todo con la presencia paternalista de Andrés, que nos hacía ir bien vestidos e intentaba que no nos drogáramos adentro. No éramos nosotros los incómodos, era únicamente él.
Para Chiri y para mí, era como volver a tener padres.
Supongo que la gota que colmó el vaso fue la llegada de los cachorros. No recuerdo a quién se le ocurrió tener perros en casa, pero los trajimos. Fuimos como esos matrimonios a la deriva que sospechan que con la llegada de un hijo todo se puede encarrilar. Una tarde, en una caja, aparecieron Roosevelt y Burela, macho y hembra. Los bautizamos igual que la esquina donde teníamos la casa.
Andrés trataba a esos perros como si fueran hijos humanos de corta edad. Les daba de comer mejor carne que a nosotros. Los peinaba, les enseñaba a cagar afuera, les acariciaba la cabeza... De repente, Chiri y yo dejamos de importarle: se había conseguido dos amigos nuevos, muchísimo más decentes y cariñosos que nosotros.
Al Chiri y a mí los perros nos divirtieron más o menos doce minutos. Después nos olvidamos por completo de su existencia. O por lo menos eso hubiéramos querido, pero Andrés nos obligaba a darles de comer y limpiar las cacas de la terraza. Chiri, alguna vez, subía con palita y escoba a limpiar. Yo no tengo recuerdo de haber hecho eso nunca en la vida.
Un fin de semana largo, Andrés tuvo que irse y dejó los perros a nuestro cuidado. Nos recomendó cien cosas: alimentos cuánto y dónde, pastillas de las pulgas a qué hora, caquita de la terraza impostergable, paseos nocturnos por la plaza, etcétera. Cuando Gelós salió por la puerta, Chiri y yo nos prendimos un porro y nos olvidamos de todo.
A la mañana siguiente Burela (la hembra) se había descompuesto y había cagado seis kilos de mierda líquida en las escaleras delanteras de la casa. El olor era insoportable. Para salir a comprar cigarros, o comida, o cerveza, era menester rodear la mierda con cuidado para no pisarla. O limpiar, claro. Pero eso no estaba en nuestros planes.
La mierda aquella duró todo el sábado, y el domingo se empezó a secar. Nosotros nos habíamos ubicado en la parte opuesta de la casa para no sentir el olor, pero la pestilencia nos perseguía. El domingo a la noche nos pusimos serios:
—Andresito vuelve el martes —dijo Chiri—, algo vamos a tener que hacer.
—Tendríamos que haber baldeado cuando la mierda estaba fresca —dije yo—. Ahora alguien va a tener que rasquetear.
Nos miramos; prendimos un porro.
El martes al mediodía, cuando Andrés volvió, la mierda ya tenía gusanitos. Y los perros estaban en la terraza, conviviendo entre mucha más mierda, llenos de moscas, y sin comida desde el domingo.
Gelós me despertó a los gritos y me citó en el comedor de nuestra casa. Llegué con cara de dormido. Me dijo que me tenía que ir, que no podía vivir más conmigo. Andrés tenía previsto que yo iba a oponer alguna resistencia, y había traído una lista de razones que acreditaban su decisión. No le hizo falta usar el listado: le dije que bueno. Que me diera unos días para buscarme algo.
—Dos días, ni uno más —me advirtió.
Después se acercó a Chiri, que había escuchado la conversación en silencio.
—No te preocupes —le dijo—, lo convencí a mi hermano Pablo para que se mude con nosotros, así seguimos siendo tres para el alquiler.
A Chiri le dio ternura que Andrés diera por sentada su permanencia.
—Yo me voy con el Gordo —le dijo sonriendo.
—Pero yo no estoy enojado con vos.
—Yo tampoco, Andresito —le dijo Chiri, y le palmeó la espalda.
Una hora más tarde estábamos metiendo los mismos libros de siempre adentro de cajas de cartón. Era la segunda vez en cinco años que nos echaban de Villa Urquiza: iba siendo hora de entender que ese barrio estaba maldito.
Los tres o cuatro días de transición no fueron amables. Ahora Andrés, además de estar enojado conmigo por lo de siempre, estaba enojado con Chiri porque había elegido irse en lugar de quedarse. Mientras buscábamos otro departamento, teníamos que seguir viendo, a diario, la cara de orto de Andrés Gelós, nuestro segundo padre, el padre más joven que tuvimos en la vida.
Desayunábamos a horas distintas para no compartir la cocina, y las pocas veces que nos cruzábamos en los pasillos, o en la redacción de Énfasis, bajábamos la vista. El toque de equilibrio a semejante frialdad lo ponía Pablo Gelós. El hermano mayor de Andrés estaba a punto de ocupar mi habitación y ya empezaba a traer sus cosas a la casa. Pablo hacía chistes e intentaba que nosotros y su hermano nos reconciliáramos, para que —al menos— el final fuera feliz.
Sin decirlo abiertamente, para no enojar más a su hermano, los gestos cómplices de Pablo nos hacían notar que él nos entendía, que sabía muy bien el esfuerzo que conlleva aferrarse a la adolescencia con las uñas y con los dientes.
La mañana que nos dieron la llave de un departamento desvencijado en la calle Guatemala, fuimos por última vez a Villa Urquiza para buscar nuestros bártulos. Andrés estaba adentro, lo vimos a través de una cortina, pero no quiso salir a despedirnos. Había sido un año agotador para él. Pablo Gelós, en cambio, nos ayudó con las cajas y le ofreció a Chiri pagar una parte del flete.
Cuando nos fuimos, pensamos que quizá habíamos elegido vivir con el hermano equivocado.
Nuestro nuevo hogar no era gran cosa. Dos ambientes chiquitos, cocina y baño. Todo el departamento, balcón incluido, podía entrar siete veces en la casa gigante de Urquiza. Pero, al revés de lo que podía pensarse, nos sentíamos libres sin Andrés quejándose por todo y persiguiéndonos para que nos bañáramos. Volvimos a comer de la olla y fumábamos más que nunca. Como el alquiler no era mucho, también renunciamos a Énfasis, un poco porque estábamos hartos del management, y otro poco para no tener que ver a Andrés nunca más en la vida.
La tercera noche en el departamento nuevo, soñé que volvía a la casa de Urquiza. Fue un sueño nítido y comprimido que no olvidé nunca más.
Yo tenía las llaves viejas y era consciente de que aquélla ya no era mi casa. Era de madrugada y sentí curiosidad por ver cómo estaban los muebles y dónde dormía Pablo Gelós. Esa curiosidad por conocer cómo son, ahora, los lugares donde vivimos antes, me persiguió toda la vida.
Entré a hurtadillas a la casa de los hermanos Gelós y subí las escaleras. Vi el comedor, exactamente igual a como lo habíamos dejado. Abrí la puerta de la habitación de Andrés y ahí estaba él, dormido. Estuve a punto de hacerle alguna maldad más, pero preferí seguir de largo.
Yo era consciente de estar dentro de un sueño, y eso me daba poderes mágicos. Subí flotando a la que había sido mi habitación. Abrí la puerta y me quedé en penumbras. En la cama estaba Pablo Gelós, el hermano mayor de Andrés, durmiendo boca arriba.
Me acerqué; Pablo se despertó. En ese momento tuve miedo de asustarlo y le tapé la boca para que no gritase. Quería decirle que con él estaba todo bien, que no era mi intención molestarlo. Pero vi sus ojos, aterrorizados, y descubrí que era tarde. No era un sueño mío donde estábamos, sino una pesadilla de él. Lo supe realmente, con una conciencia espantosa.
En general, las pesadillas deberían asustar al dueño, al que las sueña. Pero en este caso yo estaba muy tranquilo, en casa ajena, asustando a otro pobre diablo.
Los ojos de Pablo Gelós se hacían cada vez más grandes, las pupilas dilatadas, su corazón a los saltos. Cuando confirmé que el malo del sueño era yo, y que el miedo me era ajeno por completo, me ayudé con la otra mano y empecé a ahorcar a Pablo. Apreté su cuello con fuerza y me empecé a reír.
¡Ja, ja, ja!
Me desperté transpirado.
Nunca había escrito esta pesadilla, pero la conté cien veces en sobremesas, cada vez que hablamos de sueños raros. Me fascina la historia, porque por única vez yo fui el monstruo, el malo en una pesadilla ajena. Jamás hablé con Pablo Gelós para certificarlo, pero siempre me gustó pensar que esa misma noche él, durmiendo en la casa de Urquiza, soñó que yo entraba a su habitación para matarlo. ¿Por qué no?
Pasaron los años. Nunca más vi a los Gelós. Después me vine a vivir a España y tuve una hija.
Andrés tuvo dos, por lo que sé. Una noche de este siglo, Gelós le empezó a contar un cuento a sus hijas, un cuento que se llamaba «Reinas Magas». El cuento resultó ser tan interesante que lo vendió a la televisión argentina y se produjo, con la historia, una serie infantil con guiones de Andrés. En esa historia hay un malvado que se llama Das Pulgas. En la serie, a este personaje lo interpreta Pablo Gelós.
«Reinas Magas» tuvo mucho éxito en diversos países del mundo y hace un año llegó a la televisión española. Nina, mi hija de cinco años, vio todos los episodios, se rió y bailó con las protagonistas, pero también se asustó mucho con el malo malísimo del cuento, porque la interpretación de Pablo Gelós, en el papel de Das Pulgas, es magistral.
A las cuatro de la madrugada de hoy (hace un rato largo, porque ahora ya amanece) Nina se despertó a los gritos y fui a su habitación para calmarla. Entonces me contó su mal sueño. Me dijo que ella estaba durmiendo y que entraba Das Pulgas a su cuarto, que se sentaba en su cama y la despertaba. Me dijo que ella quería gritar y no podía, porque Das Pulgas le tapaba la boca con una mano.
Mientras la escuchaba tragué saliva y me puse pálido, pero creo que ella no se dio cuenta. En un segundo se me representó la revancha de Pablo, y también supe que, después de muchos meses, volvería a escribir. Tranquilicé a Nina como pude y le dije que volviera a dormir. Ella me hizo que no con la cabeza, me dijo que tenía miedo de cerrar los ojos, porque Das Pulgas podía aparecer otra vez.
La miré a los ojos y le dije, con absoluta seguridad, que eso no iba a pasar.
—¿Por qué? —me preguntó.
—Porque no te está buscando a vos —le dije—, me busca a mí.
Hernán Casciari
19 junio, 2009"
La suspensión de la incredulidad,6/21/09,"Cuesta más de una sobremesa, e infinidad de gestos y ademanes, explicarle a un ciudadano europeo de mediana edad el significado de las candidaturas testimoniales en la Argentina. 
Lo he intentado con diferentes fórmulas y en un punto todo se atasca. Al principio de la cena parece fácil lograr el objetivo, pero enseguida la conversación se complica y se sale de los carriles originales. La frontera entre la realidad y la ficción, en Europa, parece estar claramente definida, y esto dificulta muchísimo la comprensión de la política nacional. «Espera, espera, comienza otra vez, ¿pero los electores saben o no saben que los están timando?», pregunta el ciudadano europeo a la mitad del cuento. Y entonces uno cierra los ojos, respira profundo y empieza de nuevo, vocalizando mejor, usando frases neutras. Hay que arrancar de cero con una nueva introducción al tema, tal vez sea preferible hacerlo sin sarcasmos, quizá de un modo más infantil. O no. Por ahí lo mejor es recordarle al que nos escucha que somos un país muy irónico, o alertarlo sobre la enorme cantidad de teatros que hay sobre la avenida Corrientes. El obstáculo europeo para la comprensión de las candidaturas testimoniales no es moral o ético (como podría parecer) sino más bien cultural. No es que los invitados europeos a mis sobremesas se escandalicen con los enroques políticos nacionales. No señor. Es que de verdad no los comprenden. Las candidaturas testimoniales son algo exótico, borroso, más hijo de la National Geographic que de la CNN.
Así como para nosotros son exóticas ciertas costumbres tribales de los nativos de Indonesia, para ellos son nuestras costumbres políticas. Las chicas birmanas con el cogote altísimo, por ejemplo. Un argentino medio comprende que existan estas adolescentes jirafas, sabemos que desde niñas sus padres les colocan aros en el cuello, uno tras otro, etcétera. Entendemos todo. Pero no sabemos para qué lo hacen, ni qué sentido tiene. Podemos estar en contra, pero más que nada estamos en babia respecto a su utilidad. Eso que nos pasa a nosotros con las mujeres jirafa, es lo que le pasa al europeo medio con las candidaturas testimoniales. «¿Y por qué tal político dice que va, pero no va?» es lo mismo que «¿y por qué les levantan el cogote a las pobres criaturas?». A un birmano ha de costarle más de una sobremesa explicarle a un argentino el motivo verdadero de los aros en el cogote de sus hijas, estoy seguro. Es más o menos lo que me cuesta a mí, en Europa, informar a mis invitados nativos sobre por qué algunos políticos de mi nacionalidad se presentan como candidatos pero, si ganan, no tienen pensado asumir el cargo. Tal vez haya que poner a nuestro invitado sobre aviso —la frase es de Coleridge— sobre la voluntaria suspensión de la incredulidad que constituye la fe poética. 
Es decir: hay que empezar muchas décadas antes, hay que abrir juego con el «había una vez». O quizá haya que callarse la boca y empezar a sentir vergüenza... Hay algunas noches, incluso, que preferiría que mi hija tuviera el cogote altísimo, como un junco, y que mis invitados me preguntaran por ese tema, y no por la política de mi país. 
Hernán Casciari
21 junio, 2009"
El espectáculo de volar,7/5/09,"Después de los atentados del 11-S comenzó a crecer la manía de aplaudir en los aviones.
Cuando las aeronaves tocaban tierra después de muchas horas de vuelo, los pasajeros prorrumpían en una ovación cerrada. Larga, liberadora forma de alivio colectivo. Ahora ya se ha perdido esa costumbre, porque el miedo en los humanos siempre cotiza a la baja, pero el ritual duró dos o tres años y se dio en todos los aeropuertos del mundo. Eran los tiempos en que nadie se subía a un avión sin pensar en las desgracias de Nueva York, sin recordar la fragilidad de la vida. Los aplausos no marcaban un ritmo festivo (como ocurre en los teatros después de la función) ni era tampoco un batir de palmas de compromiso (como el que se ofrece después de un discurso largo y vacío). Se trataba de una nueva forma de aplauso: los pasajeros aplaudían estar vivos; aplaudían que ningún loco había viajado con ellos; aplaudían no ser noticia. 
El comportamiento humano en los aviones se torna muy inestable las semanas siguientes a que ocurra un desastre aéreo en algún lugar del mapa. Los pasajeros intercambian miradas huidizas, están atentos a las posibles reparaciones, se sobresaltan con las turbulencias. En cambio, si ningún drama ha sido tapa de los diarios en los últimos meses, todo el mundo va relajado en sus asientos y las nubes negras de la desdicha pasan de largo. Ahora, que todavía está presente el vuelo siniestrado de Air France, se suma una nueva desgracia entre Yemen y Comoras. Hay inquietud, volar no resulta fácil. Por eso el jueves pasado los pasajeros de un vuelo entre Mallorca y Newcastle no se sintieron relajados cuando, antes de despegar, las azafatas del avión los invitaron a cambiar de asiento. Sin importar el número de ubicación escrito en los billetes, la orden fue que se apretujaran todos en la parte trasera del avión. 
¿El motivo? Simple. Se había trabado una de las puertas de las bodegas donde se guardan las maletas, y entonces todos los bártulos fueron cargados en la parte delantera. Así que, para equilibrar peso, se invitaba a los pasajeros a convertirse en lastre. 
Quizá si no hubiera estado el siniestro de Air France sobrevolando el ambiente, o este nuevo accidente en Yemen, todo el pasaje habría hecho caso al pedido. El ser humano es bastante dócil cuando está relajado; es capaz de hacer caso a cualquier idiotez. Pero esta vez no. Hubo revuelo y muchos pidieron bajar. Un padre, con un hijo pequeño en brazos, dijo: «Quiero un avión donde no seamos usados como una balanza». Las azafatas tuvieron que abrir las puertas. Ciento quince pasajeros se quedaron en el aparato y setenta y uno salieron corriendo de allí. Buscaron otros vuelos, o un hotel para pasar la noche. Ahora preparan demandas para la aerolínea. Cuando el ser humano está despierto a la posibilidad del desastre, su propia vida adquiere el protagonismo de un espectáculo. De un hecho artístico sobrenatural, único, en el que si todo sale bien hay que aplaudir (batir palmas a rabiar si es necesario) y si la trama pinta mal es menester salir del cine antes de que oscurezca. 
Hernán Casciari
5 julio, 2009"
Turismo de calles cortadas,7/12/09,"Un turista, de paso por Buenos Aires, narraba absorto su primer viaje desde Ezeiza hasta el centro de la ciudad.
Explicaba el turista, con los ojos muy abiertos, de qué forma cotidiana la radio del taxi avisaba sobre las calles cortadas. Esta avenida está intransitable por la protesta de los agropecuarios; esta calle atascada por la queja de los colectiveros; aquella otra obstruida por la manifestación de los vendedores ambulantes; etcétera. El turista comentaba que el taxista tuvo que hacer más de cuatro desvíos para dejarlo en su hotel. Los días siguientes de su estancia, para sorpresa del turista, las manifestaciones y protestas continuaron —ahora eran los martilleros, después los vendedores de fruta, más tarde los veterinarios— como si cada sector del país hubiera pedido un turno para dolerse y salir a la calle a cortar el tránsito. De hecho, contaba el turista, existía en la ciudad un cronograma de cortes, un fixture detallado en donde cada agrupación quejosa se ponía de acuerdo para no salir a gritar al mismo tiempo ni en el mismo sitio. 
Muchas veces encerrado en la habitación del hotel, por culpa de las manifestaciones, el turista se quedaba mirando la televisión, y allí, en los informativos del mediodía y de la tarde, aparecían en directo los gestores de las protestas con sus pancartas y sus discursos acalorados. El turista era incapaz de individualizar los requerimientos de cada grupo. Todos decían más o menos lo mismo, todos llevaban un bombo y unas telas escritas a mano. «Llegaremos hasta las últimas consecuencias» era, en todos los casos, la frase final de los manifestantes líderes, los que llevaban la voz cantante en los micrófonos; en algunos casos pedían mayores salarios, en otros suplicaban que se les reintegrara algo que les habían quitado, y algunos deseaban ser devueltos a cierto rango perdido. El turista no entendía qué cosas podían ser «las últimas consecuencias», dado que cortar las calles tenía toda la pinta de ser un recurso extremo, el último de una larga lista, el manotazo de ahogado después de exprimir los canales lógicos de las denuncias. 
Con el tiempo (no le hizo falta más de una semana en la ciudad) el turista comprendió que obstaculizar avenidas no era el último, sino el primer paso de una denuncia en Buenos Aires. No había pasos intermedios ni desgastes anteriores: se había institucionalizado el recurso hasta quitarle el sentido y dotarlo de surrealismo. No solo los manifestantes parecían eternizados en sus gritos, sino también los ciudadanos que padecían los cortes, y las televisiones que transmitían el caos, y los policías que redactaban cronogramas diarios sobre el sitio exacto, y la hora, de cada manifestación. 
Lo sorprendente, explicaba el turista, era la capacidad que parecía tener todo el mundo para encontrarle un orden al desconcierto. Las manifestaciones, lejos de florecer por generación espontánea, se planificaban y no se superponían. Ninguna de ellas conseguía sus frutos, pero se multiplicaban. Bocinas y banderas. Gritos y cantos. Cacerolas, papelitos. La ciudad parecía adormilarse con el arrullo de la queja. 
Hernán Casciari
12 julio, 2009"
