titulo,fecha,cuento
El rincón blanco,1/11/08,"De pronto yo estaba en el hogar donde pasé la infancia; lo supo primero mi nariz. Los ojos se acostumbran tarde a la penumbra, pero mi olfato reconoció enseguida el olor inconfundible de la casa de la calle Treintaicinco. Siempre sabemos cuál es la fragancia del sitio donde crecimos; nadie acertaría a explicar de qué está compuesta, pero cada uno de nosotros es capaz de reconocer ese aroma entre miles. Y yo estaba ahora en mi casa de Mercedes. Exactamente en el sitio al que llamábamos el rincón blanco.
El rincón blanco siempre fue el epicentro de la casa. El lugar por el que había que pasar para ir a cualquier parte. No era un rincón, sino una prominencia amplia que abultaba el pasillo justo por la mitad. Y tampoco estaba pintada de blanco, pero le decíamos así. Nunca supimos por qué.
En todos los hogares hay recovecos y habitaciones que los mayores bautizan sin conciencia, y que luego nombran para siempre de una forma estrafalaria. Los hijos nacen y después crecen con la certidumbre de que esos apodos son estándares. Sólo las visitas reconocen el fallo:
—Dejá la campera y el portafolio en el rincón blanco —le decía yo a mis amigos cuando venían a tomar la leche.
—¿A dónde?
—Ahí, en el rincón blanco —y señalaba aquel sitio, empapelado con flores mustias sobre un fondo celeste, que solamente tenía un armario con cajones, un estante y un espejo.
Los niños que habitan las casas no tienen la menor idea de que algunas palabras —rincón blanco era la mía— no significan nada para el huésped ocasional, que sólo tienen sentido para los moradores, y a veces sólo para los moradores más antiguos.
Quizás ese lugar alguna vez haya sido blanco, es posible. Pero más tarde, después de mil manos de pintura, los habitantes mayores le siguen diciendo rincón blanco y los más jóvenes, por ejemplo mi hermana y yo, le decimos también así durante la infancia entera, y en la adolescencia, y también mucho después en el recuerdo, como si esas palabras fueran una referencia común en los hogares del mundo. Como si en todas las casas hubiera dormitorio, comedor, rinconblanco, baño y terraza.
Una tarde, cuando éramos todavía compañeros de primaria, mi amigo el Chiri me preguntó por qué le decíamos rincón blanco al sitio pequeño que quedaba en medio del pasillo, y entonces, sólo entonces y no antes, descubrí que no tenía el menor sentido llamar así a tres paredes empapeladas de tonos pastel. No supe qué responderle.
En otras casas, en las ajenas, también había sitios bautizados por sus dueños de un modo extraño, lugares que los habitantes llamaban de forma especial sin darse cuenta, como por ejemplo el galpón de los juguetes, que era la habitación de mi amigo Sebastián, en donde no había juguetes sino libros y cacharros; o la cocina vieja de una compañera de mi adolescencia, que era un lavadero sucio detrás de un jardín. O los cuartos de soltero de los tíos díscolos que se van pronto de casa, pero que nuestras abuelas siguen llamando la pieza de toto para siempre.
—¡No entres a la pieza de toto, que no le gusta!
Las habitaciones guardan, también en su nombre, el recuerdo de lo que fueron, por eso ahora, que de repente he aparecido —aún no sé cómo— en la que fue mi casa de los ochenta, podía oler la frescura del rincón blanco aún sin verlo, y recordé largas tardes leyendo entre esas paredes libros de Mark Twain, o escuchando música de casete en un estéreo.
De a poco mis ojos se habituaron a la falta de luz. Desde la habitación de mis padres, entreabierta y oscura, pude escuchar el murmullo de una conversación. Ya era pasada la medianoche, supuse, y estarían a punto de acostarse. Siempre tardaban muy poco en comenzar a roncar.
Mi madre roncaba igual que una Vespa con la bujía empastada, y mi padre con un silbido musical. Los dos juntos, sincopados, se oían como un motociclista al que no le importa haber quedado en mitad del camino. Me hizo ilusión quedarme un rato y comenzar a escucharlos.
Más allá del pasillo la puerta de la cocina estaba cerrada, pero se adivinaba una hendija de luz del otro lado. Reconocí entonces el tecleo apagado de una máquina de escribir. Supe sin sorpresa ni escándalo, sin asombro ninguno, que del otro lado estaba yo mismo con quince años, quizás dieciséis, escribiendo mi primera novela.
Ahora mismo, mientras narro estos detalles sensoriales, todavía no he decidido si estoy explicando un sueño o un cuento. Preferiría que fuese lo segundo: me gustaría caminar hasta la cocina, abrir la puerta y conversar con el adolescente que escribe, lleno de esperanzas y de trabas, su primera historia de largo aliento.
Me gustaría ayudarlo con la estructura del relato, y también —lo confieso— poder narrar aquí esa charla completa, más para mí que para ustedes, pero tengo demasiado presente El Otro, aquel cuento muy famoso en el que Borges, ya viejo, se topa con Borges joven en un banco de Cambridge, a la vera del río Charles, y el más viejo logra convencer al más joven de que son el mismo, y conversan sobre literatura.
Hubiera sido vergonzoso, entonces, ir hasta la cocina y conversar conmigo mismo, porque esta historia, que se llama El rincón blanco, perdería muchísimo en comparación con la historia de El Otro. Mala suerte, hay cosas que ya no se pueden escribir mejor de lo que han sido escritas.
Pero ya que estaba allí, decidí recorrer un poco la casa a oscuras, intentando no hacer nada que pudiera parecer borgeano. Comencé a caminar hasta el comedor tanteando las paredes con las manos abiertas y los brazos extendidos, dando pasos temblorosos, sin darme cuenta de que, en mi afán de no imitar la escritura de Borges, estaba plagiando su forma de moverse por las casas.
Me reí solo, mientras sacaba del bolsillo un encendedor para darme un poco de luz y no parecer un ciego.
Ahora estaba de pie frente a la habitación de mi hermana. Entré con cuidado y acerqué el encendedor para verla dormir. Ella tendría doce años si yo tenía quince, y me sorprendió —al verla dormida— cuánto se parecía a mi hija. Ese descubrimiento, insospechado, fue quizás lo mejor del sueño, porque lo que viene después será mejor olvidarlo.
La cara interior de su puerta fue otro hallazgo feliz. Hacía años que se había borrado de mi memoria ese pastiche rosa, espantoso. Florencia, en su primera juventud, escribía frases en la madera y en el marco, con rotuladores de mil colores. Y también hacía dibujitos cursis.
—Si lo amas déjalo libre —leí ahora—, si regresa siempre fue tuyo y si no biene nunca lo fue.
También había esta otra:
—Amor no es mirarse el uno al otro en los ojos, sino mirar los dos a la misma dirección —y ésta estaba rematada con unas flechas de colores lila, púrpura y rosa fuerte, y un corazón partido por la última flecha. Mi hermana no tenía una puerta, tenía un blog de MSN.
No debí haberme regodeado tanto, porque cuando llegué a mi habitación de entonces se me cayó el alma al suelo. Yo era mucho peor que mi hermana; yo era directamente un farsante. Habría preferido mil veces ser cursi como ella y escribir cosas de amor en las puertas, en lugar de tener toda la habitación empapelada con afiches de escritores que jamás en la vida había leído.
¿Qué hacía esa foto de Lenin allí, con ese bigote absurdo? Y sobre todo, ¿por qué durante toda mi adolescencia yo estuve convencido de haber colgado una de Nietzsche? Regresaron, urgentes, mis deseos de entrar a la cocina, pero ya no para conversar conmigo mismo al estilo borgeano, sino para cagar a trompadas al gordito pelotudo que estaba adentro.
Y lo habría hecho, con toda seguridad. Habría abierto la puerta de la cocina a patadas, me habría agarrado de mi camiseta de entonces con mis puños cerrados de ahora, me habría dicho que no fuera tan estúpido, que dejara de posar como un pavo real, que empezara de una vez por todas a disfrutar de la escritura en lugar de usarla como bandera, que escribiera menos, que escribiera solamente cuando me diera la gana y no cada puta noche como si de eso dependiera la salvación del mundo; me habría cacheteado, me habría pegado la cabeza contra la mesa hasta sacarme sangre, me habría hecho llorar por monigote y por pavo, de no haber sido porque escuché ruidos en la habitación de mis padres y me paralicé.
Algo, no sé qué, los había despertado.
Saqué apenas la cabeza de mi habitación adolescente y me quedé así, escondido, sin hacer un solo movimiento de más. Roberto salió primero y encendió la luz del rincón blanco. Era una luz tenue, azulada. Detrás apareció Chichita, haciendo con los brazos gestos de frío. Los dos eran mucho más jóvenes de lo que yo hubiera imaginado. Pero no fue eso lo que más me llamó la atención, sino que estaban vestidos como para salir.
—No hagas ruido que está Hernán despierto —dijo mi padre, señalando la cocina y el traqueteo de la olivetti. Ella asintió.
Fue extraño. Yo me escondía de ellos, y ellos se escondían de mí. Mi padre comenzó a tantearse los bolsillos mientras Chichita se arreglaba, con un dedo, la pintura de labios en el espejo que estaba sobre el estante.
—¿Tenés una birome? —preguntó él, en un susurro.
Mi madre rebuscó en su cartera y le pasó una Bic azul sin decir palabra. Roberto abrió uno de los cajones del rincón blanco y sacó de allí una bolsa pequeña. Después descolgó el espejo pequeño y lo puso, boca arriba, en el estante. Chichita se acercó.
—A mí no me la hagás muy grande —dijo ella—, mejor guardá un poco y la llevamos.
—No, gorda, tomemos acá. No hagas cosas raras.
Roberto peinó dos rayas finas, del largo de un dedo índice, con la tarjeta amarilla del Automóvil Club. Después chupó el borde de la tarjeta y se pasó la lengua por los dientes. Vi a Chichita doblarse sobre el anaquel y aspirar con velocidad. Después él hizo lo mismo, pero más despacio. Cuando acabaron de tomar, mi padre guardó otra vez la bolsita en el cajón del armario, mi madre colgó el espejo en la pared y caminaron hasta la cocina sin entrar. Solamente me golpearon la puerta y me avisaron:
—Nos vamos a lo de Peti y Negra.
Me escuché a mí mismo, con una voz muy atildada, contestar:
—Bueno, yo después cierro.
Antes de salir a la noche de Mercedes, Roberto apagó la luz del rincón blanco y se revisó la nariz en el reflejo de la ventana.
Hernán Casciari
11 enero, 2008"
Mínimos avances en la cama,1/24/08,"Menos la cama, todo ha mejorado en este mundo. Antes cocinábamos la sopa haciendo fuego con leña, ahora metemos el tazón directamente al microondas; hace medio siglo podíamos tener hasta cincuenta longplays en casa, hoy tenemos quinientas discografías completas en el bolsillo; ayer íbamos a los sitios a caballo y tardábamos meses en llegar, ahora nos movemos en aviones y en tren bala. Todo lo que nos importa ha evolucionado menos la cama, la cama no. Dormir sigue siendo la misma mierda desde el siglo once.
Capaz que soy yo, que me estoy haciendo viejo y ya todo me cuesta mucho, pero cuando llega la noche prefiero quedarme dormido en el sofá, o en el suelo, antes que irme a la cama.
—¿No vienes a dormir? —pregunta mi mujer.
—No, otro día.
Sólo pensar en la cantidad de cosas que hay que hacer para acostarse me desmorona. No hay nada automático, todo es manual y torpe, todo es antiguo.
Observo la vida del hombre moderno y todo parece estar bien, me siento satisfecho: un aparato nos alerta sobre la hora de despertar; enseguida una máquina nos prepara el café; después un vehículo nos conduce al trabajo; allí un dispositivo piensa por nosotros y nos corrige; por la tarde extraemos dinero de una estructura automática para insertarlo en otra que nos ofrece alimentos o cigarros; por la noche otro artefacto móvil nos devuelve al hogar; ya en casa una invención nos entretiene con música, dramaturgia o deportes; y otra maquinaria nos indica que ya es la hora de descansar.
Hasta ahí todo es perfecto.
Pero justo entonces —cuando más necesitados estamos de lo automático— sobreviene el fallo: antes de acostarnos, nosotros, los hombres modernos, los que ya hemos conseguido no realizar ni un solo esfuerzo físico, tenemos que hacernos la cama. No existe un artificio mecánico que nos libre de esa desdicha. En las casas hay control remoto para todo, hasta para bajar las cortinas. Pero no los hay para las actividades que involucran el dormir.
Solamente los japoneses y los enfermos terminales tienen control remoto en sus camas. Ellos sí. A veces me dan ganas de ser amarillo (del verbo tokio o del verbo hepatitis) para que mi cama sea automática y tenga botonera.
El hombre se ha pasado los últimos veinte o treinta años inventando una cantidad enorme de estupideces. Ya hay máquinas que te informan quién llama, con letras de imprenta, para que no lo preguntes en el teléfono. ¡A eso hemos llegado en nuestra loca aventura hacia el confort! Inventamos artefactos que nos liberan de decir «hola, ¿quién habla?». Hay herramientas que convierten el agua en hielo sin que tengas que viajar al sur. Hay lo que quieras.
Pero a la noche, cuando llega la hora del reposo, debemos airear diferentes telas, extenderlas de manera que sus puntas se toquen, simétricas, y colocar los bordes debajo de una bolsa llena de plumas; una bolsa absurda que pesa lo mismo que la lengua de un dinosaurio.
Odio el colchón actual. Lo odio con todas las fuerzas de mi alma. El colchón y el comunismo son las dos creaciones más equivocadas de la historia del Hombre. Ambos son inventos que jamás funcionaron bien del todo, pero nunca nadie se ha atrevido a decir en voz alta:
—Hemos fallado, señores, hagamos esto otra vez desde el principio.
Al contrario. Al comunismo y al colchón seguimos incorporándoles modificaciones y mejoras falsas, para disimular nuestro error de haber inventado algo tan incómodo. Colchón ergonómico, comunismo libertario; canapé abatible, izquierda moderada; somier articulado, socialismo utópico; colchón de espuma viscoelástica, partido obrero español.
No es posible que, a estas alturas del progreso, todavía haya algo en nuestros hogares que debamos limpiar pegándole con una escoba en el patio. No tiene lógica.
No puede ser que si un día nos meamos (sin querer), tengamos que pedir ayuda a un vecino para dar vuelta el colchón. Tenemos microchips, minifaldas, lentes de contacto, calditos de pollo... Una enorme variedad de cosas minúsculas. Pero a la noche dormimos en una cosa que pesa treinta y siete kilos.
Es increíble que ya tengamos coches con los que podemos chocar diez veces sin matarnos, y marcapasos con el que podemos sufrir hasta siete ataques al corazón y seguir vivos, y que —por el contrario— haya que tirar el colchón a la basura cuando nos hacemos pis dos veces. La tecnología y la modernidad parecen estar al margen de los dormitorios. Los avances se quedan en el comedor, en la cocina, en la sala de juegos.
Si comparamos una cama del año 1308 con otra de este año nos va a costar mucho encontrar un mínimo progreso. Siete siglos muertos, a la deriva de la ciencia, en donde únicamente hemos logrado construir el mismo armatoste horizontal con tres lienzos de tela encima. En setecientos años, sólo hemos conseguido ponerle elástico a las puntas de la sábana de abajo, para que no se salga cuando damos pataditas. En setecientos años, un elástico. ¿Qué carajo nos está pasando?
En estos tiempos de modernidad la cama debería venir con ingravidez de serie. Tendría que ser una cápsula gigante y hermética, sin sábanas ni frazada ni colchón de pluma. Fantaseo cada noche con un artefacto en el que mi cuerpo flota, desnudo y lánguido, siempre a una temperatura perfecta y con un leve sonido de fondo: el arrullo del mar, tres grillos en la distancia, los goles de Racing en la voz de Víctor Hugo...
En esta cama 2.0 no existiría ni el ronquido ni el insomnio, ni los ruidos externos, ni las pesadillas, ni los pedos con olor. Toda la cápsula estaría insonorizada y atenta a cualquier desliz del cuerpo o del entorno. Las almohadas tendrían un temporizador que las haría dar vuelta solas cuando notasen el cachete acalorado. Y, por supuesto, nosotros mismos estaríamos unidos a un grabador de sueños, para poder ver al día siguiente la repetición de las mejores escenas.
Yo no sé si falta mucho o poco para que lleguemos a este punto del confort. Pero lo veo muy complicado, porque los científicos están muy ocupados poniéndole más y más pelotudeces a los teléfonos móviles. Qué gente obsesiva.
Ahora me acuerdo de una frase de Juan Rulfo, el escritor mexicano. Una frase muy bonita que aparece en su novela Pedro Páramo. El protagonista se está quedando dormido sobre una roca áspera, después de haber andado todo el día por el desierto, y dice, antes de quedarse frito:
—El mejor colchón es el cansancio.
Puede ser, sí... Puede ser. En esa época los hombres se agotaban mucho, caminaban kilómetros enteros, trabajaban con las manos y la espalda, comían poco carbohidrato, se peleaban con cuchillo. Es decir, antes la gente se esforzaba. Pero ahora ya no. Hemos abolido el cansancio, hemos eliminado el sudor de la frente y el parirás con dolor. Nos hemos quitado de encima el yugo triste del siglo veinte. Hoy el único trabajo físico que nos queda es hacer la cama antes de acostarnos.
Y yo no quiero, me rebelo. Me enoja mucho que hayamos olvidado erradicar lo más importante. Nos pasamos ocho horas al día durmiendo, ¡un tercio de la vida! Dormimos más que comemos, más que viajamos, más que reímos y amamos. ¿Cómo es posible, entonces, que todavía nadie haya inventado una almohada que se enfríe sola en medio de la noche? Estamos en el nuevo milenio y tenemos que despertarnos para dar vuelta la almohada.
Somos una raza de imbéciles.
Hernán Casciari
24 enero, 2008"
