titulo,fecha,cuento
Los dos comodines,12/20/08,"Una serie de situaciones (gratas) provocaron que el mes pasado haya escrito poco en mi cuaderno. Es verdad que no redacto estas páginas para nadie, pero también es mentira: suelo andar por la casa con más soltura si el último relato de Orsai está en sintonía con una fecha cercana. Será que al publicar un texto nuevo dejo de sentir la espera ajena, o que necesito escribir por superstición amateur, para que esto no deje nunca de ser un hobbie. Sea por una cosa o por la otra, hacerlo me tranquiliza; me pone en orden.
Sobre la serie de situaciones gratas me extenderé más y mejor en otros textos, pero tiene que ver con la llegada de Chiri y su familia a este pueblo de la montaña en donde vivimos. Han llegado para quedarse, y estuvimos buscando casa, y conversando mucho por las noches. Los doce mil kilómetros de distancia que nos separaron durante ocho años se han convertido en ciento ochenta metros.
La única cagada es que la casa que consiguieron es mejor que la nuestra. Por lo demás, todo está muy bien.
Tan pronto como Chiri llegó a este pueblo nos pusimos a escribir, como dos enloquecidos, una historia de diez episodios para la televisión de España, y una obra de teatro para la próxima temporada invernal de Argentina. Esa es la razón por la que no estoy escribiendo en Orsai con la frecuencia que quisiera.
O al menos ésa es la deducción evidente, la que tiene que ver con el tiempo (los días se empecinan en tener veinticuatro horas). Pero en los territorios menos palpables, los psicológicos, es posible que haya otros motivos que expliquen esta sequía, o bloqueo literario; un motivo más escondido y profundo que, si me permiten, quisiera abordar esta tarde, más no sea como motor de impulso.
Siempre busqué desarrollar —y varias veces lo confesé en entrevistas o sobremesas— una literatura intermedia, una forma de narración que pueda ser disfrutada por dos grupos muy claros de lectores que, para mayor desafío, no suelen leer las mismas cosas. Por un lado las personas que leen mucho, por el otro aquellos que leen poco, o nada.
Para enfocar con alguna certeza esos targets, usé siempre de comodín a dos personas de mi entorno: mi padre era uno de esos lectores; Chiri, sin dudas, el otro.
Hasta que Roberto murió, en julio de este año, traté siempre de que todo lo que contaba en un papel o una pantalla lo divirtiera o lo emocionara a él, en primera medida; a él, a mi padre, en representación física de todas las personas que nunca han leído un libro. Siempre fue vital para mí, desde que tengo uso de papel, que Roberto pudiera entender lo que yo escribía, que no se quedara afuera por pedanterías intelectuales, que no se sintiera descartado u olvidado.
Posiblemente mi único orgullo serio, la única cosa que yo hice en la vida con sentido antes de Nina, sea haber logrado que Roberto leyera dos libros enteros.
Al mismo tiempo enfocaba, al narrar, a mi amigo el Chiri: quería que él también se divirtiera, que no le diera nunca la impresión de que yo escribía únicamente para mi padre o para los que nunca leían; porque el Chiri es de mi edad, porque es del palo, y porque tenemos idéntica voracidad literaria; es decir, él es la clase de lector que yo sería de mis propios textos, si pudiera leerlos sin haberlos escrito antes.
Este equilibrio, que busqué siempre entre Roberto-lector y el Chiri-lector, me daba la opción de escribir con una soltura que no tuve nunca antes, en los tiempos que narraba sin identificar a nadie, cuando mis historias no iban dirigidas a comodín alguno. Cuando ni siquiera a mí me gustaba lo que estaba a punto de narrar.
El truco no es complicado y sí, en cambio, muy recomendable: enfocar a un par de personas muy cercanas y diferentes, sólo a dos que conozcamos como la palma de la mano, juntarlas en una mesa imaginaria, y después intentar cautivarlas con una anécdota menor, con un relato elaborado, con una novela, con un cuento corto, con lo que sea. Tratando, siempre, que ninguna de las dos pierda las ganas de seguir escuchando hasta el final. Si se logra con esas dos personas, al mismo tiempo, las cosas estarán bien.
Es un buen sistema, claro que sí, o por lo menos a mí me ha servido para narrar con soltura desde que vivo en España. De hecho, tanto Más respeto que soy tu madre como cada uno de los cuentos de Orsai están basados, desde el principio, en esa premisa secreta. Haber tenido a Roberto y al Chiri a doce mil kilómetros me ayudó siempre a hilvanar sin fisuras ese discurso literario intermedio.
Hace seis meses, sin embargo, descubrí que el sistema tiende a tambalearse cuando uno de tus comodines muere, de muerte natural; cuando ya no hay manera de contarle nada nunca. Esto no significa que yo ya no pueda escribir pensando en mi padre como lector. Significa que, fatalmente, ya no puedo saber si el texto ha funcionado para él. Y eso me ha dejado, si no ciego, un poco tuerto. (Los textos de Orsai posteriores a la muerte de Roberto, lo sé yo mejor que nadie, no guardan el equilibrio que me gustaría).
La ceguera completa llegó hace poco más de un mes, en avión, con toda su familia.
Tenerlo al Chiri a mano para contarle cosas ha generado que ya no tenga la necesidad de decirle nada a través del colador literario. O incluso mejor: preferimos contar cuentos a cuatro manos para la tele, o para donde sea, con tal de afilar otra vez la frecuencia antigua del arte en colaboración.
Estamos absorbidos y felices dentro de estas nuevas ficciones, pero ya no en una dirección enfrentada, ya no desde puntos diferentes del océano, sino desde la misma orilla y dirigiéndonos a otros. Y al mismo tiempo redescubrimos las bondades de vivir otra vez en el mismo barrio, y de cenar todos juntos en una casa o en la otra, y de mirar a la vez el fútbol, y de ver las mismas películas.
No es grave lo que le ocurre a Orsai, se trata de un problema menor, emparentado con las distancias: uno de los comodines que me impulsaba a narrar se ha ido muy lejos, y el otro vive ahora en la misma manzana. Y yo estaba acostumbrado a que los dos me leyeran desde el oeste de la provincia de Buenos Aires.
Es cuestión, nada más, de encontrar otros símbolos, nuevos pretextos, otras miradas imaginarias, y volver a tejer historias.
Será en breve, no tengo dudas. Y en esta misma sala.
Hernán Casciari
20 diciembre, 2008"
Cuando los salvajes no teníamos teléfono,12/21/08,"Las imágenes violentas que ocurren en las escuelas del mundo se ven, ahora, por la tele: un alumno italiano manosea a su profesora ante la burla cómplice de sus compañeros; dos chicas, en un aula de México, se golpean hasta sacarse sangre (pero ninguna llora); una docente argentina lleva el pelo en llamarada mientras un estudiante escapa, encendedor en mano... 
Los informativos se nutren felices de estos videos con párkinson, desenfocados y nerviosos, que hasta hace diez años eran imposibles de inmortalizar en cinta. La televisión, convertida en una repetidora de internet, amplía hasta lo imposible las ventanas de YouTube y convierte el artefacto del living en el monitor de una computadora alarmista. Noche y día nos convencen los noticieros, a golpe de repetición, de que las aulas actuales son un escenario borroso, pixelado, con muchachos salvajes que practican un vandalismo de prisión centroamericana.
La sociedad se escandaliza mucho, muchísimo, al ver a estos jovencitos enloquecidos en los claustros, porque la fantasía colectiva de los padres se basa en la sospecha que sus hijos, por la mañana, están en silencio aprendiendo álgebra, y levantando la mano para ir al baño, y cantando Azul un ala del color del mar. Sin embargo, todo lo que emiten los noticieros, lo frívolo y también lo grave, lo hemos vivido, desde los doce y hasta los diecisiete años, en las escuelas y los colegios analógicos del siglo veinte. Entonces no teníamos teléfonos móviles para grabar nuestras fechorías, ni software para musicalizarlas, ni banda ancha para subirlas a un internet que era, todavía, un sueño de ciencia ficción. Pero cometíamos idénticas salvajadas, cuanto más escandalosas mejor, para que el rumor volara, por la ventana del aula, hasta las calles del pueblo o del barrio. Lo que hacíamos (eso sí) tras cometer la tropelía, era un relato oral a la salida del colegio; engalanábamos la brutalidad, y al día siguiente, con suerte, aquello se convertía en el tema de conversación de los mayores. Si aparecía en el periódico del pueblo, ya tocábamos el cielo.
Hoy ese alarmismo vetusto de peluquería es la médula ósea de los noticieros en medio mundo. Qué poco han avanzado los informativos, en los tiempos de las nuevas tecnologías, si se nutren de lo que, hace dos décadas, era la chismografía de los almacenes de pueblo. Y ni hablar de nosotros mismos, que, olvidadizos del pasado, debatimos sobre impedir que los alumnos entren al aula con sus teléfonos. O, por lo menos, de castigar a quienes publican estos videos en internet. Qué interesante forma del olvido: sospechamos que las fechorías solo ocurren porque alguien las está grabando, y salteamos el hecho de que la difusión de esos documentos fílmicos son la mejor prueba para certificar una situación de violencia que impera desde hace décadas. Prohibir los teléfonos en las mochilas de los alumnos, o castigar a quienes difunden los videos, es igual a tapiar las ventanas del colegio y dejar que los estudiantes aúllen sin testigos. Como ocurría en las épocas analógicas, cuando éramos nosotros los salvajes y no teníamos con qué filmar ni publicar nuestro descontento.
 Hernán Casciari
21 diciembre, 2008"
Inocente palomita que te dejaste engañar,12/28/08,"Aquí en España, con gran certidumbre, los lectores abren las páginas del periódico los 28 de diciembre esperando que una de las noticias de portada resulte falsa. 
Es bastante habitual que la prensa, incluida la rigurosa, festeje con algún pescado podrido el Día de los Santos Inocentes. Hace tanto que se repite como un calco este guiño puntual, que ya la broma es más esperada que imprevista. Y la costumbre, como se sabe, es enemiga de la diversión.
En otros pueblos hispanos (del norte de México y sur de Estados Unidos) cunde un hábito mucho más divertido y estrafalario: los días como hoy todos deben cuidarse muy bien de no prestar nada, ni dinero ni objetos ni ayuda, pues el prestatario tendrá luz verde para no devolver lo procurado o apropiarse de lo pedido.
La frase usada por el mangante, tras recibir la dádiva, es algo así: «Inocente palomita que te dejaste engañar, sabiendo que en este día nada me debes dar». La inocencia, en este caso, sí resulta intempestiva y edificante, también burlesca y ambigua, porque uno nunca sabe si el que está requiriendo alguna cosa, el que está implorando nuestra ayuda, lo hace por sincera necesidad o por fastidiarnos el día.
Es por lo menos irónico que estas dos tradiciones populares sean —justo hoy— la comidilla informativa de medio mundo. Hace tres años, el gobierno de Bush le pidió al de Zapatero apoyo aéreo para trasladar presos a Guantánamo, y éste se lo concedió. El hecho ha sido ratificado a pesar de que, hace unos días, el presidente español aseguró que no sabía nada de los vuelos de la CIA y que, de saberlo, lo hubiera denunciado. Bush, por supuesto, ha hecho magnánimo silencio al respecto, como si pensara, al ver a su par español en problemas, aquello de «inocente palomita que te dejaste engañar...». Y el otro, asustado como un perro que ha volteado la maceta, sale ahora a mentir por las televisiones asegurando que tal cosa no ocurrió jamás, y que todo lo concerniente a Guantánamo es una barbaridad y un despropósito. 
Qué folklórica resulta a veces la política internacional: las costumbres del 28 de diciembre de ambos pueblos (la de pedir y desentenderse, por un lado; y la de mentir con descaro en la prensa, por el otro) han sido sintetizadas por sus mismísimos mandatarios en los días previos a la celebración del Día de los Santos Inocentes. Y para rizar el rizo de las casualidades, el tema central de todo el atolladero es un grupo fantasmal de presos que han ido y han venido en aviones nocturnos, como maletas o perros, desde la guerra de Oriente a un centro de detenidos ilegales en Cuba, sin juicio previo ni posterior, y que todavía hoy con tinúan esperando, en un limbo legal que va para cuatro años, que alguien venga a explicarles que, en las democracias de Occidente, existe una garantía consagrada por la Declaración de los Derechos Humanos, un principio jurídico llamado presunción de inocencia. Es decir: que alguien venga y les diga, por fin, que la inocencia te valga.
Hernán Casciari
28 diciembre, 2008"
Belleza prohibida en televisión,1/10/09,"Se acaban de prohibir en España las propagandas de televisión que promuevan el culto al cuerpo. 
Los canales no podrán emitir esta publicidad en horario de protección al menor, es decir, desde las seis de la mañana a las diez de la noche. Esto no significa que se prohíba vender un coche (o un yogur, o una bujía de tractor) mostrando el cuerpo de una mujer o de un hombre semidesnudo, sino que estará vedado hacer apología de adelgazantes, de intervenciones de cirugía estética o de belleza. Ya nadie podrá emitir publicidad que «suscite el rechazo de la autoimagen — dice la ley— o que incite a la marginación social por la condición física o al éxito por factores de peso o estética». 
No son nuevos estos recortes a la libertad de expresión. En España la publicidad viene con unos cartelitos en los que se atiende la sensibilidad de los espectadores con frases como «para realizar esta publicidad no se han maltratado animales». La miopía es singular: durante un programa de gastronomía se puede ver a cualquier cocinero hervir un langostino vivo alegremente, pero si durante la publicidad una señora mete un pez de colores al microondas, hay que especificar que no se ha maltratado al animal. El langostino que se embrome por ser comestible. Creo que todo empezó en 2004. Después de mucho intentarlo en vano, la publicidad española parió una buena idea. El spot era de la franquicia catalana Bocatta, que vende comida rápida con ingredientes mediterráneos. El aviso era precioso: con unas coplas irónicas de música alegre, en la que se informa sobre la trabajosa labor de las zonas rurales, se recomienda consumir productos campestres, pero sin pasar por la penuria agraria de su elaboración. La frescura del contraste entre las imágenes y la musiquita generaba algo que jamás había conseguido la publicidad española de los últimos años: ser creativa imponiendo además una marca. En cualquier país decente se le hubiese dado un premio a ese anuncio. Pero aquí no pasan esas cosas. A los tres días de emitido, el coordinador general de la Unión de Campesinos de Catalunya le puso una denuncia a Bocatta por ofrecer una imagen de los trabajadores rurales que calificó de «denigrante». Casi al mismo tiempo, la Asociación Valenciana de Agricultores invitó a todo el sector agrícola a «cerrar filas y no consumir ni uno solo de esos productos». 
Ahora le ha tocado a la belleza: prohibidas las publicidades de adelgazantes, cirugías y cremas que tapan granitos y espinillas. La Ley General de Comunicación Audiovisual estuvo a punto, incluso, de meter en la misma bolsa la publicidad de productos bajos en calorías. Pero los fabricantes de alimentos light pusieron el grito en el cielo y este último ítem quedó en la nada. Hubiera resultado simpático que el mismo Gobierno que hace tres meses quitó la custodia de un niño a sus padres porque el menor estaba demasiado gordo, ahora le quitara al niño la opción de ver productos dietéticos por la televisión. 
Hernán Casciari
10 enero, 2009"
Fascinación por el objeto llamado libro,1/11/09,"La región de Bihar, en la India, vive estos días una ola de frío que ya causó la muerte de una treintena de personas. En una aldea del distrito de Gaya hay una escuela que, como muchas del invierno argentino, no tiene calefacción, ni kerosene para las estufas, ni presupuesto para emparchar los vidrios rotos de las ventanas.
La semana pasada, dos profesores del octavo curso decidieron hacer una hoguera para que los alumnos, chicos y chicas congelados de catorce años, dejaran de castañetear los dientes y pudieran seguir la clase con atención. Hasta aquí, una historia penosa —pero también cotidiana— de los obstáculos educativos en el tercer mundo. El problema es que los profesores utilizaron, para avivar la fogata, el único papel disponible en la escuela: los libros. Quemaron los más gordos, aquellos con mayor cantidad de papel; fueron al fuego volúmenes de sánscrito que encontraron en la biblioteca, manuales de lengua urdu recién llegados del ministerio, pulposos diccionarios (cómo no) y los libros de matemáticas que los propios alumnos llevaban en sus mochilas. Todo al fuego, para que la sangre volviera a circular por las venas.
Al día siguiente un grupo de padres denunciaron en la comisaría del pueblo a los maestros, acusándolos de quemar los libros de la escuela, que son un símbolo de la cultura y un patrimonio común. «Informé al inspector de educación del distrito y lo denunciaré ante el juez para que tome medidas contra los profesores », dijo el jefe del consejo local, Shyam Deo Prasad, mientras la noticia era recogida por las agencias de todo el mundo y muchos otros lectores de diversos países también ponían el grito en el cielo.
Resulta fascinante la devoción que todavía suscita el sustantivo «libros» entre las personas que han recibido educación suficiente. Y también llama la atención la repugnancia que les provoca el verbo «quemar » a aquellos que han recibido esa educación en medio de un clima templado. Para ellos, el sustantivo «libros» no parece aceptar matices. Quemar libros está muy mal; leer libros está muy bien. No importa si se queman para que unos chicos no mueran de frío, ni tampoco importa si se leen mayoritariamente los peores. El sustantivo «discos» no tiene tanto pedigrí: si uno dice «ayer borré un millón de PDF con clásicos de mi disco rígido» la sobremesa sigue su curso. Pero si otro informa «tiré al contenedor un montón de libros después de la mudanza», alguien dirá, compungido, «¡los hubieras donado!» y los demás brindarán miles de opciones tendientes a la preservación eterna de cualquier obra, por buena o pésima que sea. Muchos conservan una susceptibilidad pre-tecnológica respecto del valor de los libros. Una demasiada intensidad emocional sobre las acciones de quemarlos, donarlos, preservarlos, robarlos, prestarlos o usarlos. Lo más sorprendente es que, técnicamente, se pierde más cultura cuando se estropea un disco rígido extraíble de 160 gigas que cuando se queman todos los volúmenes encuadernados de una escuela, para que los alumnos puedan calentarse.
Hernán Casciari
11 enero, 2009"
El Síndrome de Acumulación Compulsiva,1/18/09,"Han descubierto un nuevo trastorno, pariente directo del Síndrome de Diógenes (aquel que padecen quienes amontonan kilos y kilos de basura en casa) y primo hermano del Trastorno Obsesivo Compulsivo (la enfermedad que hizo popular Jack Nicholson en Mejor imposible). 
De la mezcla de estos dos males ha aparecido ahora el SAC, Síndrome de Acumulación Compulsiva, que consiste en guardar cosas por si algún día resultan necesarias. En este caso ya no se trata de traer al hogar porquería maloliente, ni de encender y apagar el interruptor de la luz, sino de conservar objetos inútiles con alguna historia personal detrás (un pétalo de rosa entre las páginas de un libro, o un boleto de colectivo del año 1966) y otros trastos inservibles que se quedan en los cajones por si alguna vez tenemos que consultarlos. Para más inri, parece que un 4 por ciento de la población mundial ya está afectada, según ha publicado esta semana la revista científica American Journal of Psychiatry. No se especifica en el artículo, sin embargo, si este nuevo síndrome explica —además— la crisis económica y de valores que padece el mundo occidental, y que también, a simple vista, parece ser hija de esta nueva enfermedad. El directivo de la financiera que compró deuda incobrable de otra, por ejemplo, ¿padece del ya vetusto Síndrome de Diógenes o del flamante Síndrome de la Acumulación Compulsiva? El gerente del banco que dio créditos hipotecarios a potenciales morosos sin aval ni garantía, ¿sufre del viejo TOC o sufre del nuevo SAC?
Según explican los doctores del Institute of Psychiatry de Londres (padres del descubrimiento), todos podemos sentir la necesidad de guardar objetos con un determinado valor sentimental. «El problema se produce —dicen— cuando esta necesidad dificulta nuestro día a día, cuando la acumulación hace impracticables los movimientos cotidianos y cuando nos sentimos avergonzados». Quizás la ola de suicidios de altos ejecutivos y brokers en quiebra (el magnate inmobiliario estadounidense Steven Good y el directivo francés Thierry Magon fueron los últimos) explique también ese sentimiento de vergüenza que otorga la acumulación.
El caso de Magon es paradigmático: había sido cofundador de la gestora de fondos Access International, pero se cortó las venas en Navidad y su cuerpo fue hallado en su despacho de Nueva York; el hombre —en su afán de acumular— había perdido 1.400 millones de dólares con el fraude de Madoff. El ‘valor sentimental’ de esa pérdida fue, quizás, demasiado para él. Y también para Pablo Sergio Silva, que se pegó un tiro en el pecho en medio de una sesión bursátil brasileña. O el broker hindú Aamir Ali, que se colgó del ventilador de su casa antes de fin de año. O el quinto hombre más rico de Alemania, Adolf Merckle, que se arrojó al paso del tren en su pueblito de Blaubeuren. Todos habían acumulado demasiados papeles inservibles y recuerdos sentimentales, todos habían perdido, de un día para el otro, sus pétalos de rosa, ya marchitos e inútiles, apretados entre las páginas de un libro.
 Hernán Casciari
18 enero, 2009"
Somos sensibles al terremoto,1/24/09,"La prensa europea me está sorprendiendo estos días. Le está dando a la tragedia de Haití una cantidad de páginas en prensa, y de minutos en televisión, muy superior a la que suelen dar a la gente negra que se muere en países distantes y pobres.
El 4 de abril de 1994 —por ejemplo— recrudeció en Ruanda una guerra civil entre dos tribus (los tutsis y los hutus) que costó la vida de 800 mil personas analfabetas de color negro en cuarenta y ocho horas. La portada de los diarios, al día siguiente, no mencionaba el asunto. Al menos en la prensa occidental de la que existe una hemeroteca online (como el periódico La Vanguardia, que es el que estoy usando para contrastar), la noticia de la desaparición de casi un millón de negros analfabetos aparecía en un recuadro perdido en la página quince, cuatro días después de que ocurrieran los hechos. En cambio, la muerte de tres mil seres humanos blancos alfabetizados durante el 11-S apareció en portada y en las siguientes 39 páginas de todos los diarios. Utilizo ex profeso los colores 'blancos' y 'negros' para dar cuenta de la cantidad de melanina existente en la piel de los muertos en cada uno de los acontecimientos. Y hasta podría adentrarme en la descripción y decir: muertos con traje y corbata (en un caso) y muertos en camiseta o en cuero (en el otro caso). Muertos limpios; muertos sucios. Muertos parecidos a mí; muertos distintos a mí. Quizá lo que ocurre con frecuencia no merece la pena ser contado. Quizá ahora Haití es portada porque la noticia es el terremoto, y no la muerte. Porque, ¿qué diferencia hay entre el Haití de hoy y el Haití del año pasado? Que esta semana se han muerto de a montones, y no en un lento goteo insensible. Quizá en seis meses, cuando los chiquitos haitianos vuelvan a morirse con la lentitud habitual —ya no por escombro en la cabeza, sino por el hambre de siempre— los países industrializados dejen de sentir esta irrefrenable necesidad de ayudar. Pero no nos preocupemos, porque este hecho natural (es decir, que está en nuestra naturaleza) también se da en otros ámbitos. Atención que voy a poner un ejemplo muy lindo: por un lado, miles y miles de africanos se mueren de hambre a diario y tienen que comerse entre ellos; esto lo sabemos, y no pasa nada. Por el otro lado, se cae un avión con 18 deportistas uruguayos que deben practicar canibalismo para sobrevivir; el asunto genera una novela de trescientas páginas, un documental de la BBC, una película en la que Ethan Hawke toma mate y un almuerzo anual con los sobrevivientes en el programa de Mirtha Legrand. ¿Por qué esa diferencia? ¿Por qué el Milagro de los Andes nos sigue produciendo escalofríos treinta años después, y el cotidiano goteo del hambre en elmundo no? Porque los uruguayos son como nosotros; porque «podría habernos pasado». La muerte cotidiana de gente distinta, que no juega nuestros deportes, que se viste de un modo raro, que se divide en tribus, nos importa menos. Y no nos acordamos poco de esas muertes porque ocurren todos los días. Nos acordamos cuando mueren de otra cosa. Por ejemplo, por un terremoto. 
Hernán Casciari
24 enero, 2009"
